<?xml version = "1.0" encoding = "UTF-8"?>
xmlns:xsi = "http://www.w3.org/2001/XMLSchema-instance"
xsi:noNamespaceSchemaLocation = "exercicio1.xsd" >
<persoa>
    <dni>111111111</dni>
    <nome>Carlos Pacheco</nome>
    <estadoCivil>Soltero</estadoCivil>
    <empresa>
        <nome>Marvel</nome>
        <url>http://www.marvel.com</url>
        <telefono>+34916753306</telefono>
    </empresa>
</persoa>
